question_id,status,score,checks_passed,checks_total,question_text,option_A,option_B,option_C,option_D,correct_answer,CCSS,DOK,clarity_precision_status,clarity_precision_reason,grammatical_parallel_status,grammatical_parallel_reason,homogeneity_status,homogeneity_reason,length_check_status,length_check_reason,passage_reference_status,passage_reference_reason,plausibility_status,plausibility_reason,single_correct_answer_status,single_correct_answer_reason,specificity_balance_status,specificity_balance_reason,standard_alignment_status,standard_alignment_reason,too_close_status,too_close_reason
guiding_21014_302001_sibling_1,✅ PASSED,90%,9,10,"When Aladdin's father died, his mother had to work hard to earn money for",travel and adventures,food and shelter,fancy clothes and jewelry,books and school supplies,B,RL.3.1,1,✅,"The question is clear and unambiguous. The pronouns are properly referenced (Aladdin's father, his mother), the sentence structure is straightforward, and the question asks a specific, understandable concept: what did Aladdin's mother need to earn money for after his father died. The answer choices ",✅,"All four answer choices follow the same grammatical pattern: each consists of two plural nouns connected by ""and"" (noun + and + noun). Specifically: A) travel and adventures B) food and shelter C) fancy clothes and jewelry D) books and school supplies  While there is minor variation in that some nou",✅,"All answer choices represent the same conceptual category: types of expenses or things that money can be spent on. Each option (travel/adventures, food/shelter, fancy clothes/jewelry, books/school supplies) represents a different category of expenditure that Aladdin's mother might have worked to aff",✅,Choice lengths are balanced,✅,"The question ""When Aladdin's father died, his mother had to work hard to earn money for"" does not contain any specific passage references such as paragraph numbers, line numbers, section titles, or structural elements. It is simply asking about content related to the story of Aladdin without referen",✅,"All three incorrect choices (A, C, and D) are plausible distractors. They represent things that require money and could reasonably confuse a student who partially understands the story. A student might think: (A) the mother worked to fund Aladdin's adventures, (C) to provide luxuries for the family,",❌,"The passage field is empty - there is no text provided to validate the answer against. Without passage content, it's impossible to determine if answer B (food and shelter) is the only defensibly correct answer or if other options could also be supported. The question cannot be properly validated wit",✅,"All four answer choices follow the same structural pattern: [category] and [category]. Each option presents two related items at a similar level of generality: - A) ""travel and adventures"" - two general leisure concepts - B) ""food and shelter"" - two basic necessities - C) ""fancy clothes and jewelry""",✅,"The question directly assesses RL.3.1 (Ask and answer questions about key details). The question asks students to identify a key detail from the text - specifically, what Aladdin's mother had to work for after his father died. This requires students to locate and recall explicit information from the",✅,"None of the distractors are synonymous with or degree-variants of 'food and shelter'; they refer to luxuries (A, C) or education (D), not basic necessities."
guiding_21015_302002_sibling_1,✅ PASSED,90%,9,10,Which word best describes how the magician acts when Aladdin cannot hand him the lamp right away?,patient,playful,angry,thankful,C,RL.3.3,1,✅,"The question is clear and precise. It has a specific subject (the magician), a clear action being evaluated (how he acts), a defined moment (when Aladdin cannot hand him the lamp right away), and asks for a straightforward descriptor (which word best describes). The pronouns ""him"" clearly refers to ",✅,"All four answer choices are single adjectives: ""patient,"" ""playful,"" ""angry,"" and ""thankful."" They follow the same grammatical pattern and structure, with each being a one-word adjective that could describe someone's behavior or demeanor. This is consistent parallelism.",✅,"All four answer choices (patient, playful, angry, thankful) are emotional states or character traits that describe how someone acts or behaves. They all belong to the same conceptual category of descriptive adjectives for behavior/demeanor. The question asks how the magician acts, and all options ap",✅,All choices are 3 words or less,✅,"The question does not contain any specific passage references such as paragraph numbers, line numbers, section titles, or page numbers. It simply asks about content that should be found somewhere in the passage (how the magician acts when Aladdin cannot hand him the lamp right away). Since there are",✅,"All three incorrect choices (A: patient, B: playful, D: thankful) are plausible distractors for this question about the magician's behavior in the Aladdin story. ""Patient"" could fool students who misremember the scene or confuse it with earlier parts where the magician might have been more controlle",❌,"I cannot validate this question because the passage itself is missing. Without the passage text, I cannot determine whether the magician's behavior when Aladdin cannot hand him the lamp is described in a way that makes ""angry"" (choice C) the only defensibly correct answer, or whether other options l",✅,"All four answer choices are single-word adjectives describing emotional states or attitudes at the same level of specificity. ""Patient,"" ""playful,"" ""angry,"" and ""thankful"" are all common, straightforward descriptors of behavior/emotion that are equally accessible and concrete. None are overly techni",✅,"The question directly assesses RL.3.3, which requires students to describe characters and explain how their actions contribute to story events. The question asks students to describe the magician's character (specifically his emotional state/behavior) based on his actions when Aladdin cannot immedia",✅,"None of the distractors (patient, playful, thankful) are synonymous with or easily confusable with 'angry'; they are semantic opposites or unrelated moods."
guiding_21016_302003_sibling_1,❌ FAILED,60%,6,10,The reader can tell this story is a fantasy because the magician,traveled from far away,promised to help Aladdin,spoke magic words that made the sky turn dark,climbed up a steep mountain,C,RL.3.5,2,❌,"The question has a critical clarity issue: it references ""this story"" without providing the passage/story itself. Students cannot answer the question because they don't have access to the text being referenced. While the question structure is clear and the answer choices are unambiguous, the missing",✅,All four answer choices follow the same grammatical pattern: each is a verb phrase in past tense beginning with a verb and followed by additional information. Specifically: - A) traveled (verb) + prepositional phrase - B) promised (verb) + infinitive phrase - C) spoke (verb) + noun phrase + relative,❌,"The question asks what makes this story a fantasy. All choices should be elements that indicate fantasy genre. However, choices A, B, and D (traveled from far away, promised to help, climbed a mountain) are ordinary, realistic actions that could occur in any story type. Only choice C (spoke magic wo",❌,Correct answer (9 words) too long,✅,"The question ""The reader can tell this story is a fantasy because the magician"" does not contain any specific structural references to the passage such as paragraph numbers, line numbers, section titles, quotes, or page numbers. It is a general question about the content. Since there are no passage ",✅,"All three incorrect choices (A, B, D) are plausible distractors. They represent events that could reasonably occur in the Aladdin story but don't definitively indicate fantasy. A student who partially understands the concept of fantasy might confuse: - ""traveled from far away"" (A) - exotic settings ",✅,"The question asks what indicates this is a fantasy story. Let me evaluate each choice:  A) ""traveled from far away"" - This is realistic; people can travel from far away in real life B) ""promised to help Aladdin"" - This is realistic; people make promises in real life C) ""spoke magic words that made t",✅,"All four answer choices are at similar levels of specificity and detail. Each option describes a simple, concrete action or event: - A) ""traveled from far away"" - simple action with basic descriptor - B) ""promised to help Aladdin"" - simple action with object - C) ""spoke magic words that made the sky",❌,"The standard RL.3.5 requires students to refer to parts of stories, dramas, and poems when writing or speaking about a text, using terms like chapter, scene, and stanza, and to describe how each successive part builds on earlier sections. This is about understanding text structure and organization. ",✅,"Only option C clearly signals a fantasy element (supernatural magic), while A, B, and D describe ordinary actions that do not indicate fantasy. They are not synonymous with C nor equally supported."
guiding_21017_302004_sibling_1,❌ FAILED,50%,5,10,This story was most likely written to,explain how to become a merchant,describe the beauty of gardens and gems,show readers that being impatient can cause problems,tell readers about mountains in Persia,C,RL.3.6,2,❌,"The question has a critical clarity issue: it references ""This story"" but no passage/story is provided in the context given. Without the actual story text, students cannot determine the author's purpose. The question itself is grammatically clear and the answer choices are well-structured, but the q",✅,"All four answer choices follow the same grammatical pattern: infinitive verb phrase (""to"" + verb) followed by a noun phrase or clause. Specifically: - A) ""to become"" (infinitive) + noun phrase - B) ""to describe"" (infinitive) + noun phrase - C) ""to show"" (infinitive) + noun phrase/clause - D) ""to tel",✅,This is an author's purpose question asking why the story was written. All four answer choices represent different possible purposes for writing the text: A) to explain/teach (how to become a merchant) B) to describe (beauty of gardens and gems) C) to teach a lesson/moral (about impatience) D) to in,❌,Correct answer (8 words) too long,✅,"The question ""This story was most likely written to"" does not contain any specific passage references such as paragraph numbers, line numbers, section titles, quotes, or other structural elements. It is a general question about the purpose or intent of the story. Since there are no passage reference",❌,"Choice D (""tell readers about mountains in Persia"") appears to be too specific and geographic to be a plausible distractor for a story's main purpose. While the story may be set in Persia with mountains mentioned, this is clearly a setting detail rather than the author's purpose. This would be obvio",❌,"I cannot validate this question because the passage itself is missing from the provided information. Without the actual story/passage text, I cannot determine whether: - Choice C (impatience causing problems) is the clear main purpose - Choices A, B, or D could also be defended as correct - The pass",✅,"All four answer choices are at similar levels of specificity. Each option describes a potential purpose of the story using comparable detail: - A) ""explain how to become a merchant"" - specific purpose with concrete subject - B) ""describe the beauty of gardens and gems"" - specific purpose with concre",❌,"RL.3.6 requires students to distinguish their own point of view from that of the narrator or characters. This question asks about author's purpose (""This story was most likely written to""), which assesses RL.3.2 (determining theme/central message/lesson) or RI.3.6 (author's purpose in informational ",✅,"The distractors focus on explaining a trade, describing scenery, or informing about geography, which are not synonymous with showing a moral about impatience."
quiz_302005_sibling_1,✅ PASSED,90%,9,10,"When the magician says Aladdin can ""take any treasures you want,"" what does the word ""treasures"" mean in this part of the story?",Valuable items like gems and jewels,Special memories from the adventure,Magical powers from the lamp,Friends who will help him escape,A,RL.3.4,2,✅,"The question is clear and precise. It asks for the meaning of a specific word (""treasures"") in a specific context (when the magician speaks to Aladdin). The question structure is straightforward with no ambiguous pronouns, double negatives, or overly complex syntax. The phrase ""in this part of the s",✅,"All four answer choices follow the same grammatical pattern: they are all noun phrases consisting of a plural noun (""items,"" ""memories,"" ""powers,"" ""friends"") modified by an adjective or descriptor (""Valuable,"" ""Special,"" ""Magical,"" ""Friends who will help him escape""). Each choice is then followed by",✅,"This is a word meaning question asking what ""treasures"" means in context. All four answer choices provide different possible interpretations/definitions of what ""treasures"" could mean: A) physical valuable items, B) memories, C) magical powers, D) helpful friends. Each choice represents a different ",✅,Choice lengths are balanced,✅,"The question references a quote from ""the magician"" saying ""take any treasures you want"" and asks about the meaning of ""treasures"" in ""this part of the story."" However, no passage text is actually provided - the passage field is empty. Since there are no specific structural references (like paragrap",✅,"All three incorrect choices (B, C, D) are plausible distractors for a vocabulary question about ""treasures"" in the Aladdin story context:  B) ""Special memories"" - This represents a common figurative interpretation of ""treasure"" that students encounter in modern contexts (e.g., ""treasured memories""),",❌,"The passage itself is missing from this question, making it impossible to verify whether answer A is the only defensibly correct answer. Without the actual text showing the context of when the magician says ""take any treasures you want,"" I cannot determine: 1) Whether ""treasures"" clearly refers to v",✅,"All four answer choices are at similar levels of specificity and detail. Each option provides a clear, concrete interpretation of what ""treasures"" could mean in the context: - A) ""Valuable items like gems and jewels"" - specific physical objects with examples - B) ""Special memories from the adventure",✅,"The question directly assesses RL.3.4, which requires students to determine the meaning of words and phrases as they are used in a text. The question explicitly asks what the word ""treasures"" means ""in this part of the story,"" requiring students to use context clues from the passage to determine the",✅,None of the distractors are synonymous with or easily confusable for 'treasures' as used here; only A refers to concrete valuable items.
quiz_302005_sibling_2,✅ PASSED,80%,8,10,"In the story, the magician tells Aladdin the lamp ""had amazing powers."" Based on the story, what does ""amazing powers"" mean?",The lamp can make a person very wealthy,The lamp can light up dark places,The lamp can tell the future,The lamp can make someone disappear,A,RL.3.4,2,✅,"The question is clear and precise. It directly asks students to interpret the meaning of ""amazing powers"" based on the story context. The quoted phrase is clearly attributed to the magician speaking to Aladdin. There are no ambiguous pronouns, double negatives, or overly complex structures. The ques",✅,"All four answer choices follow the same grammatical pattern. Each option consists of: - ""The lamp can"" + verb phrase - A) ""can make a person very wealthy"" - B) ""can light up dark places"" - C) ""can tell the future"" - D) ""can make someone disappear""  All choices use the modal verb ""can"" followed by a ",✅,"This is a word meaning question asking what ""amazing powers"" means in the context of the story. All four answer choices (A-D) present different possible powers/abilities that the lamp could have - making someone wealthy, lighting dark places, telling the future, or making someone disappear. Each cho",❌,Correct answer (8 words) too long,✅,"The question does not contain any specific structural references to the passage (no paragraph numbers, line numbers, section titles, or page numbers). It only references a quote (""had amazing powers"") that would need to exist in the passage for the question to be valid, but the task is specifically ",✅,"All three incorrect choices (B, C, D) are plausible distractors for a question about a magic lamp's ""amazing powers."" Choice B (lighting up dark places) is a reasonable literal interpretation since it is a lamp. Choice C (telling the future) and Choice D (making someone disappear) are both common ma",❌,"The passage provided is empty/missing. Without the actual story text, I cannot verify whether ""amazing powers"" specifically refers to making someone wealthy (A), lighting dark places (B), telling the future (C), or making someone disappear (D). The question asks what ""amazing powers"" means ""based on",✅,"All four answer choices are at similar levels of specificity. Each option describes a single, concrete capability that a magical lamp might have: making someone wealthy (A), providing light (B), predicting future events (C), or causing disappearance (D). All are expressed in simple, parallel languag",✅,"The question directly assesses RL.3.4, which requires students to determine the meaning of words and phrases as they are used in a text. The question asks students to interpret what ""amazing powers"" means based on the story context. Students must use textual evidence to determine which answer choice",✅,Options B–D describe different abilities and are not synonymous with or equally supported as A; there is no double-key risk.
quiz_302005_sibling_3,✅ PASSED,80%,8,10,"The magician tells Aladdin about ""a great treasure"" under the stone. What does the phrase ""great treasure"" mean in this story?",Something very valuable that will make Aladdin rich,A wonderful story about kings and queens,A close friendship between two people,A beautiful place to visit on vacation,A,RL.3.4,2,✅,"The question is clear and precise. It asks students to interpret the meaning of a specific phrase (""great treasure"") within the context of the story. The phrase is properly quoted and attributed to a specific character and situation. There are no ambiguous pronouns, double negatives, or overly compl",✅,"All four answer choices follow the same grammatical pattern. Each option consists of: 1. An indefinite article (""A"") 2. An adjective modifier (""very valuable"", ""wonderful"", ""close"", ""beautiful"") 3. A noun phrase that serves as the subject 4. Additional descriptive elements (relative clauses or prepo",✅,"This is a word meaning question asking what the phrase ""great treasure"" means in the story context. All four answer choices provide different possible definitions/meanings of what ""great treasure"" could refer to: A) valuable riches, B) a story, C) a friendship, D) a beautiful place. While these are ",❌,Correct answer (8 words) too long,✅,"The question references a specific quote ""a great treasure"" and states it appears in the passage where ""the magician tells Aladdin about 'a great treasure' under the stone."" However, no passage text is actually provided to verify against. Since the passage field is empty, I cannot verify whether thi",❌,"Choice B (""A wonderful story about kings and queens"") and Choice D (""A beautiful place to visit on vacation"") are obviously wrong and unrelated to what ""treasure"" means in any context. While Choice C (""A close friendship"") could represent a metaphorical interpretation of ""treasure,"" Choices B and D ",✅,"The phrase ""great treasure"" in the context of Aladdin stories universally refers to valuable material wealth.   A) ""Something very valuable that will make Aladdin rich"" - This is the literal and contextual meaning of ""treasure"" in this story context. Correct.  B) ""A wonderful story about kings and q",✅,"All four answer choices are at similar levels of specificity and detail. Each option provides a simple, clear interpretation of ""great treasure"" using everyday language: - A: ""Something very valuable that will make Aladdin rich"" (concrete material wealth) - B: ""A wonderful story about kings and quee",✅,"The question directly assesses RL.3.4, which requires students to determine the meaning of words and phrases as they are used in a text. The question asks students to interpret what ""great treasure"" means specifically in the context of this story (Aladdin). The answer choices require students to dis",✅,"Only option A matches the clear, literal meaning of 'great treasure' as wealth in the Aladdin context; the other options are unrelated concepts."
quiz_302005_sibling_4,✅ PASSED,80%,8,10,"What does the magician mean when he says the ring ""will keep you safe from any harm""?",The ring will protect Aladdin from danger,The ring will help Aladdin find his way home,The ring will make Aladdin invisible to others,The ring will give Aladdin the strength to lift heavy stones,A,RL.3.4,2,✅,"The question is clear and precise. It directly asks what the magician means by a specific quoted phrase ""will keep you safe from any harm."" There are no ambiguous pronouns - ""he"" clearly refers to the magician, and ""you"" refers to the person being addressed (presumably Aladdin based on context). The",✅,"All four answer choices follow the same grammatical pattern. Each option begins with ""The ring will"" followed by a verb phrase: - A) ""will protect Aladdin from danger"" - B) ""will help Aladdin find his way home"" - C) ""will make Aladdin invisible to others"" - D) ""will give Aladdin the strength to lift",✅,"All answer choices interpret what ""keep you safe from any harm"" means by offering different types of magical protection or powers the ring might provide. Each choice presents a different possible meaning/function of the ring's protective power: physical protection (A), navigation help (B), invisibil",❌,Shortest distractor (8 words) too long,✅,"The question asks about what the magician means when he says the ring ""will keep you safe from any harm"". This question contains a quote reference but does not make any specific structural references to the passage such as paragraph numbers, line numbers, section titles, or page numbers. Since the q",✅,"All three incorrect choices (B, C, D) are plausible distractors. Each represents a reasonable misinterpretation of what ""keep you safe from any harm"" might mean in a magical context: - B (finding way home) relates to safety through navigation/not being lost - C (invisibility) is a common magical pro",❌,"The passage itself is missing from this question, making it impossible to verify whether answer A is the only defensibly correct answer or if other options could also be supported. Without the actual passage text, I cannot determine if the magician's statement ""will keep you safe from any harm"" is d",✅,"All four answer choices are at similar levels of specificity and detail. Each option presents a concrete, specific function that the ring could perform: - A: protection from danger - B: navigation/wayfinding assistance - C: invisibility power - D: enhanced physical strength  Each choice uses straigh",✅,"The standard RL.3.4 requires students to determine the meaning of words and phrases as they are used in a text, distinguishing literal from non-literal language. This question directly assesses this skill by asking students to interpret what the phrase ""will keep you safe from any harm"" means in con",✅,Only option A paraphrases 'keep you safe from any harm'; other options introduce unrelated abilities not implied by the phrase.
