question_id,status,score,checks_passed,checks_total,question_text,option_A,option_B,option_C,option_D,correct_answer,CCSS,DOK,clarity_precision_status,clarity_precision_reason,grammatical_parallel_status,grammatical_parallel_reason,homogeneity_status,homogeneity_reason,length_check_status,length_check_reason,passage_reference_status,passage_reference_reason,plausibility_status,plausibility_reason,single_correct_answer_status,single_correct_answer_reason,specificity_balance_status,specificity_balance_reason,standard_alignment_status,standard_alignment_reason,too_close_status,too_close_reason
quiz_302006_sibling_1,✅ PASSED,90%,9,10,Why does Aladdin become trapped in the cave?,He refuses to hand over the lamp immediately.,He steals too many treasures from the garden.,He accidentally breaks the magic spell.,He loses the special ring the magician gave him.,A,RL.3.3,2,✅,"The question is clear, precise, and unambiguous. It asks a straightforward cause-and-effect question about a specific event (Aladdin becoming trapped in the cave). The subject ""Aladdin"" is clearly identified, the verb ""become trapped"" is specific, and the location ""in the cave"" is unambiguous. There",✅,"All four answer choices follow the same grammatical pattern: Subject (""He"") + verb in simple present tense + object/complement. Each choice is a complete sentence with parallel structure: - A) He refuses... - B) He steals... - C) He accidentally breaks... - D) He loses...  The addition of the adverb",✅,"All answer choices represent possible causal explanations for why Aladdin becomes trapped in the cave. Each option presents a different action or event (refusing to hand over the lamp, stealing treasures, breaking a spell, losing the ring) that could serve as the reason for the entrapment. They all ",✅,Choice lengths are balanced,✅,"The question ""Why does Aladdin become trapped in the cave?"" does not contain any specific passage references such as paragraph numbers, line numbers, section titles, quotes, or other structural elements. It is a straightforward content question that does not reference any particular location within ",✅,"All three incorrect choices (B, C, D) are plausible distractors for the Aladdin story:  B) ""He steals too many treasures from the garden"" - This is plausible because Aladdin does encounter a magical garden with jeweled fruits in the cave, and a student might reasonably confuse taking treasures as th",❌,"I cannot validate this question because no passage was provided. The task requires verifying that exactly one answer can be ""defended based on the passage,"" but there is no passage text included to reference. Without the passage, I cannot determine whether answer A (or any other option) is defensibl",✅,"All four answer choices are at similar levels of specificity and detail. Each option provides a concrete action or event with comparable complexity: - A) ""refuses to hand over the lamp immediately"" - specific action with timing detail - B) ""steals too many treasures from the garden"" - specific actio",✅,"The question directly assesses RL.3.3, which requires students to describe characters and explain how their actions contribute to story events. The question asks students to identify WHY Aladdin becomes trapped (the consequence) by connecting it to a character's action (Aladdin refusing to hand over",✅,"None of the distractors are synonymous with or easily confused with the correct cause. They present distinct, unsupported causes (stealing treasures, breaking a spell, losing a ring) versus refusing to hand over the lamp."
quiz_302006_sibling_2,✅ PASSED,80%,8,10,What causes the magician to become angry with Aladdin?,Aladdin cannot give him the lamp right away.,Aladdin touches the treasures he was told not to touch.,Aladdin tells his mother about the cave.,Aladdin drops the lamp and it breaks.,A,RL.3.3,2,✅,"The question is clear, precise, and unambiguous. It uses straightforward language asking for a specific cause-and-effect relationship (what causes the magician's anger). The subject ""the magician"" is clearly identified, as is ""Aladdin."" There are no ambiguous pronouns, double negatives, or overly co",✅,"All four answer choices follow the same grammatical pattern. Each option is a complete sentence in the present tense with the structure: ""Aladdin"" (subject) + verb phrase + object/complement. Specifically: A) Aladdin cannot give him the lamp right away. B) Aladdin touches the treasures he was told n",✅,This is a character motivation/cause question asking what triggers the magician's anger. All four answer choices present different possible actions by Aladdin that could cause the magician's anger: A) A delay in obtaining the lamp B) Disobeying instructions about treasures C) Revealing information t,✅,Choice lengths are balanced,✅,"The question ""What causes the magician to become angry with Aladdin?"" does not contain any specific passage references such as paragraph numbers, line numbers, section titles, quotes, or page numbers. It is a straightforward content question that does not reference any structural elements of the pas",✅,"All three incorrect choices (B, C, D) are plausible distractors for the Aladdin story. Choice B relates to a common element in the tale where Aladdin is given instructions about the treasures in the cave. Choice C involves a logical story element about telling his mother, which could confuse student",❌,"I cannot validate this question because no passage is provided. The task requires verifying that exactly one answer can be ""defended based on the passage,"" but there is no passage text included to reference. Without the passage, I cannot determine: 1) Whether answer A is actually supported 2) Whethe",✅,All four answer choices are at similar levels of specificity and detail. Each option presents a concrete action or situation involving Aladdin that could cause the magician's anger: - A) describes a timing/availability issue with the lamp - B) describes a rule violation regarding treasures - C) desc,❌,"The assigned standard is RL.3.3: ""Describe characters and explain how their actions contribute to story events."" This standard requires students to make connections between character actions and their consequences/effects on the plot.  The question asks ""What causes the magician to become angry with",✅,"The distractors describe different causes (touching treasure, telling his mother, breaking the lamp) and are not synonymous with A. Only A matches the typical cause of the magician’s anger."
quiz_302006_sibling_3,✅ PASSED,70%,7,10,What happens as a result of Aladdin collecting too many gems?,His bag becomes too heavy to climb out easily.,The magician refuses to help him at all.,The cave begins to collapse around him.,The magic ring stops working properly.,A,RL.3.3,2,✅,"The question is clear, precise, and unambiguous. It uses straightforward language with no ambiguous pronouns, double negatives, or overly complex structure. ""What happens as a result of Aladdin collecting too many gems?"" directly asks about a cause-and-effect relationship that is easy to understand.",✅,"All four answer choices follow the same grammatical pattern: they are complete sentences in the present tense with the same structure (Subject + Verb + Object/Complement). Each begins with a noun phrase as the subject (""His bag,"" ""The magician,"" ""The cave,"" ""The magic ring"") followed by a verb phras",✅,"All answer choices describe consequences or results of Aladdin collecting too many gems. Each option presents a different negative outcome (bag too heavy, magician refuses help, cave collapses, ring stops working), but they all belong to the same conceptual category: they are all potential consequen",❌,Correct answer (9 words) too long,✅,"The question ""What happens as a result of Aladdin collecting too many gems?"" does not contain any specific passage references such as paragraph numbers, line numbers, section titles, quotes, or page numbers. It is a general content question about the passage. Since there are no passage references to",✅,"All three incorrect choices (B, C, D) are plausible distractors for the Aladdin story. Choice B relates to the magician's role and potential consequences of Aladdin's greed. Choice C invokes a common trope in treasure cave stories where taking too much triggers a collapse. Choice D references the ma",❌,"I cannot validate this question because no passage was provided. Without the passage text, I cannot verify whether answer A (or any other answer) is the only defensibly correct answer based on the source material. The question references events that should be described in a passage about Aladdin col",✅,"All four answer choices are at similar levels of specificity and detail. Each option presents a concrete, specific consequence of Aladdin collecting too many gems: - A) Describes a physical consequence (weight) and its effect (difficulty climbing) - B) Describes a character's action/reaction (magici",❌,"RL.3.3 requires students to describe characters and explain how their actions contribute to story events. This question asks about a consequence of Aladdin's action (collecting too many gems), which appears surface-level aligned. However, the question is actually testing reading comprehension of a c",✅,"Options B, C, and D describe distinct outcomes (lack of help, cave collapse, ring malfunction) and are not synonyms or degree variants of A's consequence (bag too heavy)."
quiz_302006_sibling_4,✅ PASSED,70%,7,10,Why does Aladdin say he cannot reach the lamp when the magician asks for it?,The lamp is buried deep in his heavy bag.,He dropped the lamp somewhere in the cave.,The lamp is still hanging in the garden tree.,He wants to keep the lamp for himself.,A,RL.3.3,2,✅,"The question is clear and unambiguous. It asks for a specific reason why Aladdin gives a particular excuse to the magician. The pronouns are clear - ""he"" refers to Aladdin and ""it"" refers to the lamp (which is explicitly mentioned). The sentence structure is straightforward with no double negatives ",✅,"All four answer choices follow the same grammatical pattern: they are complete sentences in the present tense with ""The lamp"" as the subject (A, B, C) or ""He"" as the subject (D). Each provides a declarative statement explaining a reason. While A, B, and C specifically mention ""the lamp"" and D uses """,✅,This is a character motivation/reasoning question asking why Aladdin says he cannot reach the lamp. All four answer choices provide different possible reasons or explanations for Aladdin's statement: A) Physical obstacle (lamp buried in bag) B) Physical circumstance (lamp was dropped) C) Physical lo,✅,Choice lengths are balanced,✅,"The question ""Why does Aladdin say he cannot reach the lamp when the magician asks for it?"" does not contain any specific structural references to the passage such as paragraph numbers, line numbers, section titles, page numbers, or other structural elements. It is a content-based question that asks",✅,"All three incorrect choices (B, C, D) are plausible distractors for the Aladdin story. Choice B (dropped the lamp) is reasonable as students might confuse the sequence of events in the cave. Choice C (lamp hanging in garden tree) relates to an actual location in the story where the lamp might be fou",❌,"The passage is missing - there is no text provided to verify the answer against. Without the passage, I cannot determine whether answer A (or any other answer) is defensibly correct, or whether multiple answers could be argued as correct. The question asks about a specific detail from the Aladdin st",✅,"All four answer choices are at similar levels of specificity and detail. Each option provides a concrete, single-clause explanation for why Aladdin cannot reach the lamp: - A: Physical location explanation (in bag) - B: Physical location explanation (dropped in cave) - C: Physical location explanati",❌,"The assigned standard is RL.3.3: ""Describe characters and explain how their actions contribute to story events."" This requires students to analyze character motivations and connect actions to plot consequences.  The question asks ""Why does Aladdin say he cannot reach the lamp when the magician asks ",❌,The prompt 'Why does Aladdin say he cannot reach the lamp?' can mean either the stated excuse (A) or his underlying motive (D). Both can be considered correct depending on interpretation.
quiz_302007_sibling_1,❌ FAILED,60%,6,10,"Based on the story, what is the main lesson about making promises?",Not all promises from strangers can be trusted.,Always keep your promises no matter what happens.,Making promises to family members is most important.,Promises about money will always come true.,A,RL.3.2,3,❌,"The question has a critical clarity issue: it references ""the story"" but no passage or story is provided. Students cannot answer what the ""main lesson about making promises"" is without knowing what story is being discussed. This makes the question impossible to evaluate or answer in its current form",✅,"All four answer choices follow the same grammatical pattern. Each option is a complete declarative sentence in the present tense with a modal verb or simple present: A) ""Not all promises from strangers can be trusted."" (modal verb construction) B) ""Always keep your promises no matter what happens."" ",✅,All four answer choices present different lessons or principles about promises. Each option offers a distinct moral or takeaway about the nature of promises: - A) addresses trustworthiness of promises from strangers - B) addresses commitment to keeping promises - C) addresses priority/importance of ,✅,Choice lengths are balanced,✅,"The question ""Based on the story, what is the main lesson about making promises?"" does not contain any specific structural references to passage elements such as paragraph numbers, line numbers, section titles, specific quotes, or page numbers. It makes a general reference to ""the story"" but does no",❌,"Choice D (""Promises about money will always come true"") is obviously wrong and a throwaway option. Any reasonable student would recognize this as an absolute statement that contradicts basic life experience - promises about money frequently are not kept. This is not a plausible misconception or a su",❌,"The passage itself is missing from this question, making it impossible to verify whether answer choice A (or any other choice) is defensibly correct based on textual evidence. Without the actual story content, I cannot determine: 1) Whether the story involves strangers making promises 2) What the ac",✅,All four answer choices are at similar levels of specificity and detail. Each option presents a complete lesson statement about promises with comparable complexity: - A) addresses trust and strangers (one qualifier) - B) addresses commitment and circumstances (one qualifier) - C) addresses importanc,❌,"RL.3.2 requires students to ""recount the story, including fables, folktales, and myths from diverse cultures; determine the central message, lesson, or moral and explain how it is conveyed through key details in the text.""  While this question does ask about a ""lesson"" (which aligns with determining",✅,"Options B, C, and D express different morals (keeping promises universally, prioritizing family promises, or guarantees about money) rather than the idea of trusting promises from strangers; none are synonymous or degree-only variations of A."
quiz_302007_sibling_2,❌ FAILED,60%,6,10,What lesson does the story teach about greed?,Greed can cause people to hurt others to get what they want.,Greedy people always get exactly what they deserve.,Working hard is better than being greedy for treasure.,Greed only happens to poor people who want money.,A,RL.3.2,3,❌,"The question has a critical clarity issue: it references ""the story"" without any story being provided in the passage section. Students cannot answer what lesson ""the story"" teaches about greed when no story is present. This creates complete ambiguity about what text they should be analyzing. While t",✅,"All four answer choices follow the same grammatical pattern: they are complete sentences that begin with a noun phrase about ""greed"" or ""greedy people"" followed by a verb phrase making a statement about greed. Each choice presents a complete declarative sentence with consistent structure (Subject + ",✅,"All four answer choices present potential lessons or moral statements about greed. Each option offers a different perspective on what the story might teach about greed (its effects on behavior, consequences, alternatives, or who experiences it), but they all remain within the same conceptual categor",❌,Correct answer (12 words) too long,✅,"The question ""What lesson does the story teach about greed?"" does not contain any specific passage references such as paragraph numbers, line numbers, section titles, quotes, or page numbers. It is a general question about the content/theme of the passage. Since there are no passage references to ve",✅,"Evaluating the incorrect choices (B, C, D):  **Choice B** (""Greedy people always get exactly what they deserve"") - This is a plausible distractor. It represents a common misconception about moral lessons in stories - the idea of ""just deserts"" or karma. Students often oversimplify story morals into ",❌,"I cannot validate this question because no passage was provided. The question explicitly references ""the story"" and asks what lesson it teaches, but there is no story text included for me to evaluate. Without the passage, I cannot determine: 1) Whether answer A is actually supported by the story 2) ",✅,"All four answer choices are at similar levels of specificity. Each presents a complete statement about greed using everyday language and similar sentence structures. They all make broad moral claims about greed (its effects, consequences, or scope) without being overly technical or varying significa",❌,"The assigned standard is RL.3.2, which requires students to ""recount stories, including fables, folktales, and myths from diverse cultures; determine the central message, lesson, or moral and explain how it is conveyed through key details in the text.""  While the question does ask about a lesson (mo",✅,"B asserts an absolute outcome, C shifts to a work-ethic moral rather than harm caused by greed, and D makes a false overgeneralization. None are near-synonymous with A or equally supported."
quiz_302007_sibling_3,❌ FAILED,50%,5,10,What does this story teach about judging people?,You cannot always tell if someone is good by how they act at first.,People who hug you are always telling the truth.,Magicians are always dishonest and cannot be trusted.,Poor people are more honest than rich people.,A,RL.3.2,3,❌,"The question has a critical clarity issue: it uses the ambiguous demonstrative pronoun ""this story"" without providing the actual story in the passage section. Students cannot answer what a story teaches about judging people when no story is present. The question assumes context that is missing, maki",✅,"All four answer choices follow the same grammatical pattern: they are complete declarative sentences that make statements about people or behavior. Each choice has a subject and predicate structure: - A) ""You cannot always tell..."" (complete sentence) - B) ""People who hug you are..."" (complete sente",✅,"All answer choices present lessons or moral statements about judging people or trustworthiness. Each option offers a different potential lesson that could be drawn from a story about evaluating others: A) about initial appearances, B) about trusting specific behaviors, C) about stereotyping occupati",❌,Correct answer (14 words) too long,✅,"The question ""What does this story teach about judging people?"" does not contain any specific passage references such as paragraph numbers, line numbers, section titles, quotes, or other structural elements. It is a general comprehension question about the passage's theme. Since there are no passage",❌,"Choice B (""People who hug you are always telling the truth"") is too obviously wrong and absurd to be a plausible distractor. Any reasonable student would recognize this as an extreme overgeneralization that doesn't represent a genuine lesson about judging people. Choice C makes an overgeneralization",❌,"I cannot validate this question because the passage itself is missing. Without the passage, I cannot determine: 1) Whether answer A is actually supported by the text 2) Whether any of the other answers (B, C, or D) could also be defended based on the passage content 3) Whether the passage addresses ",✅,All four answer choices are at similar levels of specificity and detail. Each option presents a complete moral lesson or judgment principle in straightforward language: - A) Makes a general statement about judging character based on initial behavior - B) Makes a specific claim about people who hug a,❌,"The assigned standard is RL.3.2, which requires students to recount stories and determine the central message, lesson, or moral. While the question does ask about what the story teaches (which aligns with identifying a lesson/moral), the answer choices present significant problems. Choices B, C, and",✅,"The distractors are not synonymous with A and make absolute or biased claims (always, specific groups) that are clearly different from the general lesson in A."
quiz_302007_sibling_4,❌ FAILED,50%,5,10,What does the story suggest about being patient?,Impatience can lead to making bad decisions that hurt others.,Patient people always get magical treasures in the end.,Being impatient helps you get things done faster.,Only children need to learn to be patient.,A,RL.3.2,3,❌,"The question has a critical clarity issue: it references ""the story"" but no story/passage is provided in the context given. Students cannot answer what a story ""suggests"" without having access to that story. While the question itself is grammatically clear and the answer choices are well-structured,",✅,"All four answer choices follow the same grammatical pattern: they are complete sentences in the present tense that make declarative statements about patience/impatience. Each choice has a subject (noun phrase) and predicate (verb phrase): A) ""Impatience can lead...""  B) ""Patient people always get...",✅,"All four answer choices address the same conceptual category: lessons or messages about patience/impatience. Each choice presents a different potential interpretation of what the story suggests about being patient - whether it's about consequences of impatience (A), rewards for patience (B), benefit",❌,Correct answer (10 words) too long,✅,"The question ""What does the story suggest about being patient?"" does not contain any specific passage references such as paragraph numbers, line numbers, section titles, quotes, or page numbers. It is a general interpretive question about the passage content. Since there are no passage references to",❌,"Choice B (""Patient people always get magical treasures in the end"") is a plausible distractor as it represents a common misconception about story morals - that patience is always literally rewarded. Choice C (""Being impatient helps you get things done faster"") represents another reasonable misconcep",❌,"The passage is missing from this question, making it impossible to verify whether answer A (or any answer) can be defended based on textual evidence. Without the passage, I cannot determine if: - The story actually shows impatience leading to bad decisions that hurt others (A) - The passage mentions",✅,"All four answer choices are at similar levels of specificity and detail. Each option presents a complete statement about patience that includes: (1) a subject (impatient people, patient people, being impatient, or only children), (2) a verb/action, and (3) a consequence or outcome. They are all writ",❌,"The assigned standard is RL.3.2, which requires students to ""recount the story, including fables, folktales, and myths from diverse cultures; determine the central message, lesson, or moral and explain how it is conveyed through key details in the text.""  While this question does ask about a lesson/",✅,None of the distractors are semantically close to option A; they express opposite or unrelated ideas.
